{
  "schema_version": "plugin-workshop-metadata/v1",
  "generated_at": "2026-10-10T05:11:01+00:00",
  "source": "GitHub API + canonical ownership and organization identity data",
  "plugins": {
    "pegaflow": {
      "repository": "vLLM-HUST/pegaflow-hust",
      "repository_url": "https://github.com/vLLM-HUST/pegaflow-hust",
      "metrics": {
        "stars": 0,
        "forks": 1,
        "open_pull_requests": 0
      },
      "maintainers": [
        {
          "login": "cybber695",
          "name": "陈彦博",
          "profile_url": "https://github.com/cybber695",
          "avatar_url": "https://avatars.githubusercontent.com/u/215857808?v=4"
        },
        {
          "login": "zhangshengxiang682",
          "name": "张盛翔",
          "profile_url": "https://github.com/zhangshengxiang682",
          "avatar_url": "https://avatars.githubusercontent.com/u/150900551?v=4"
        }
      ],
      "advisors": [
        {
          "name_zh": "张书豪",
          "name_en": "Shuhao Zhang",
          "relationship": "internal"
        }
      ],
      "maintainer_source": "ecosystem.json#component.maintainers"
    },
    "pegaflow-vllm-connectors": {
      "repository": "vLLM-HUST/pegaflow-hust",
      "repository_url": "https://github.com/vLLM-HUST/pegaflow-hust",
      "metrics": {
        "stars": 0,
        "forks": 1,
        "open_pull_requests": 0
      },
      "maintainers": [
        {
          "login": "cybber695",
          "name": "陈彦博",
          "profile_url": "https://github.com/cybber695",
          "avatar_url": "https://avatars.githubusercontent.com/u/215857808?v=4"
        },
        {
          "login": "zhangshengxiang682",
          "name": "张盛翔",
          "profile_url": "https://github.com/zhangshengxiang682",
          "avatar_url": "https://avatars.githubusercontent.com/u/150900551?v=4"
        }
      ],
      "advisors": [
        {
          "name_zh": "张书豪",
          "name_en": "Shuhao Zhang",
          "relationship": "internal"
        }
      ],
      "maintainer_source": "ecosystem.json#component.maintainers"
    },
    "adm": {
      "repository": "vLLM-HUST/ascend-distributed-metadata",
      "repository_url": "https://github.com/vLLM-HUST/ascend-distributed-metadata",
      "metrics": {
        "stars": 0,
        "forks": 0,
        "open_pull_requests": 0
      },
      "maintainers": [
        {
          "login": "sad-and-bad1231",
          "name": "匡明轩",
          "profile_url": "https://github.com/sad-and-bad1231",
          "avatar_url": "https://avatars.githubusercontent.com/u/183976079?v=4"
        }
      ],
      "advisors": [
        {
          "name_zh": "张书豪",
          "name_en": "Shuhao Zhang",
          "relationship": "internal"
        }
      ],
      "maintainer_source": "ecosystem.json#component.maintainers"
    },
    "bidkv": {
      "repository": "vLLM-HUST/vllm-hust-bidkv",
      "repository_url": "https://github.com/vLLM-HUST/vllm-hust-bidkv",
      "metrics": {
        "stars": 1,
        "forks": 0,
        "open_pull_requests": 2
      },
      "maintainers": [
        {
          "login": "MingqiWang-coder",
          "name": "王明琪",
          "profile_url": "https://github.com/MingqiWang-coder",
          "avatar_url": "https://avatars.githubusercontent.com/u/184908272?v=4"
        },
        {
          "login": "cybber695",
          "name": "陈彦博",
          "profile_url": "https://github.com/cybber695",
          "avatar_url": "https://avatars.githubusercontent.com/u/215857808?v=4"
        }
      ],
      "advisors": [
        {
          "name_zh": "张书豪",
          "name_en": "Shuhao Zhang",
          "relationship": "internal"
        }
      ],
      "maintainer_source": "ecosystem.json#component.maintainers"
    },
    "diffspec": {
      "repository": "vLLM-HUST/vllm-ascend-hust-diffspec",
      "repository_url": "https://github.com/vLLM-HUST/vllm-ascend-hust-diffspec",
      "metrics": {
        "stars": 0,
        "forks": 1,
        "open_pull_requests": 0
      },
      "maintainers": [
        {
          "login": "dzcixy",
          "name": "杜忠承",
          "profile_url": "https://github.com/dzcixy",
          "avatar_url": "https://avatars.githubusercontent.com/u/52349195?v=4"
        }
      ],
      "advisors": [
        {
          "name_zh": "黄禹",
          "name_en": "Yu Huang",
          "relationship": "internal"
        }
      ],
      "maintainer_source": "ecosystem.json#component.maintainers"
    },
    "vspec": {
      "repository": "vLLM-HUST/vllm-hust-vSpec",
      "repository_url": "https://github.com/vLLM-HUST/vllm-hust-vSpec",
      "metrics": {
        "stars": 0,
        "forks": 0,
        "open_pull_requests": 0
      },
      "maintainers": [
        {
          "login": "Renty-0",
          "name": "任天宇",
          "profile_url": "https://github.com/Renty-0",
          "avatar_url": "https://avatars.githubusercontent.com/u/290501286?v=4"
        }
      ],
      "advisors": [
        {
          "name_zh": "王庆刚",
          "name_en": "Qinggang Wang",
          "relationship": "internal"
        }
      ],
      "maintainer_source": "ecosystem.json#component.maintainers"
    },
    "latchmoe": {
      "repository": "vLLM-HUST/vllm-ascend-hust-LatchMoE",
      "repository_url": "https://github.com/vLLM-HUST/vllm-ascend-hust-LatchMoE",
      "metrics": {
        "stars": null,
        "forks": null,
        "open_pull_requests": null
      },
      "maintainers": [
        {
          "login": "Li-changwu",
          "name": "李昶吾",
          "profile_url": "https://github.com/Li-changwu",
          "avatar_url": "https://avatars.githubusercontent.com/u/215941469?v=4"
        },
        {
          "login": "pluviophile-chen",
          "name": "陈德斌",
          "profile_url": "https://github.com/pluviophile-chen",
          "avatar_url": "https://avatars.githubusercontent.com/u/109889198?v=4"
        }
      ],
      "advisors": [
        {
          "name_zh": "张书豪",
          "name_en": "Shuhao Zhang",
          "relationship": "internal"
        }
      ],
      "maintainer_source": "ecosystem.json#component.maintainers"
    },
    "opfuse": {
      "repository": "vLLM-HUST/vllm-hust-opfuse",
      "repository_url": "https://github.com/vLLM-HUST/vllm-hust-opfuse",
      "metrics": {
        "stars": null,
        "forks": null,
        "open_pull_requests": null
      },
      "maintainers": [
        {
          "login": "KimmoZAG",
          "name": "KimmoZAG",
          "profile_url": "https://github.com/KimmoZAG",
          "avatar_url": "https://avatars.githubusercontent.com/u/95903923?v=4"
        }
      ],
      "advisors": [
        {
          "name_zh": "张书豪",
          "name_en": "Shuhao Zhang",
          "relationship": "internal"
        }
      ],
      "maintainer_source": "ecosystem.json#component.maintainers"
    },
    "ascend-quant-toolkit": {
      "repository": "vLLM-HUST/vllm-ascend-quant-hust",
      "repository_url": "https://github.com/vLLM-HUST/vllm-ascend-quant-hust",
      "metrics": {
        "stars": 0,
        "forks": 0,
        "open_pull_requests": 0
      },
      "maintainers": [
        {
          "login": "aly16-k",
          "name": "王鸿坤",
          "profile_url": "https://github.com/aly16-k",
          "avatar_url": "https://avatars.githubusercontent.com/u/179479893?v=4"
        }
      ],
      "advisors": [
        {
          "name_zh": "项翔",
          "name_en": "Xiang Xiang",
          "relationship": "internal"
        }
      ],
      "maintainer_source": "ecosystem.json#component.maintainers"
    },
    "kvcompress-ascend": {
      "repository": "vLLM-HUST/vllm-ascend-kvcompress-hust",
      "repository_url": "https://github.com/vLLM-HUST/vllm-ascend-kvcompress-hust",
      "metrics": {
        "stars": 0,
        "forks": 0,
        "open_pull_requests": 0
      },
      "maintainers": [
        {
          "login": "Jiawan23",
          "name": "张家万",
          "profile_url": "https://github.com/Jiawan23",
          "avatar_url": "https://avatars.githubusercontent.com/u/113904488?v=4"
        }
      ],
      "advisors": [
        {
          "name_zh": "万瑶",
          "name_en": "Yao Wan",
          "relationship": "internal"
        }
      ],
      "maintainer_source": "ecosystem.json#component.maintainers"
    },
    "prefix-router-migration": {
      "repository": "vLLM-HUST/vllm-hust-prefix-router",
      "repository_url": "https://github.com/vLLM-HUST/vllm-hust-prefix-router",
      "metrics": {
        "stars": 0,
        "forks": 0,
        "open_pull_requests": 0
      },
      "maintainers": [
        {
          "login": "Amber1qq",
          "name": "郑凌峰",
          "profile_url": "https://github.com/Amber1qq",
          "avatar_url": "https://avatars.githubusercontent.com/u/135104141?v=4"
        },
        {
          "login": "WMASTER123",
          "name": "王杰",
          "profile_url": "https://github.com/WMASTER123",
          "avatar_url": "https://avatars.githubusercontent.com/u/156131214?v=4"
        },
        {
          "login": "Adr1anZheng",
          "name": "Adr1anZheng",
          "profile_url": "https://github.com/Adr1anZheng",
          "avatar_url": "https://avatars.githubusercontent.com/u/289145544?v=4"
        }
      ],
      "advisors": [
        {
          "name_zh": "刘海坤",
          "name_en": "Haikun Liu",
          "relationship": "internal"
        },
        {
          "name_zh": "张书豪",
          "name_en": "Shuhao Zhang",
          "relationship": "internal"
        }
      ],
      "maintainer_source": "ecosystem.json#component.maintainers"
    },
    "kv-tiering-migration": {
      "repository": "vLLM-HUST/vllm-hust-kv-tiering",
      "repository_url": "https://github.com/vLLM-HUST/vllm-hust-kv-tiering",
      "metrics": {
        "stars": 0,
        "forks": 0,
        "open_pull_requests": 0
      },
      "maintainers": [
        {
          "login": "JieYang2001",
          "name": "杨杰",